{
  "protocol": "org.sempersupra.secure-messaging.v1",
  "message_id": "msg-0001",
  "message_type": "example.available",
  "sender": "@sender:example.org",
  "target": "@recipient:example.org",
  "created_at": "2026-08-23T09:00:00Z",
  "correlation_id": "corr-0001",
  "causation_id": null,
  "expires_at": "2026-08-24T09:00:00Z",
  "requires_ack": true,
  "idempotency_key": "example-0001",
  "body": {
    "application": "synthetic-consumer",
    "value": 42
  }
}
